NCT Number,Title,Status,Gender,Phases,Enrollment,Locations,URL
NCT04575584,Efficacy and Safety of Molnupiravir (MK-4482) in Hospitalized Adult Participants With COVID-19 (MK-4482-001),Recruiting,All,Phase 2|Phase 3,1300,"Kaiser Foundation Hospital - South Bay ( Site 1832), Harbor City, California, United States|Cedars-Sinai Medical Center ( Site 1822), Los Angeles, California, United States|University of California Davis Health ( Site 1809), Sacramento, California, United States|University Of Florida ( Site 1810), Gainesville, Florida, United States|Wellstar Kennestone Hospital ( Site 1801), Marietta, Georgia, United States|Loretto Hospital ( Site 1838), Chicago, Illinois, United States|LSU-HSC Shreveport ( Site 1824), Shreveport, Louisiana, United States|Henry Ford Health System ( Site 1821), Detroit, Michigan, United States|University of Mississippi Medical Center ( Site 1846), Jackson, Mississippi, United States|University of Nebraska Medical Center ( Site 1835), Omaha, Nebraska, United States|University of New Mexico, Health Sciences Center ( Site 1806), Albuquerque, New Mexico, United States|Carolinas Medical Center ( Site 1850), Charlotte, North Carolina, United States|ECU Adult Specialty Care ( Site 1865), Greenville, North Carolina, United States|Sanford Health ( Site 1851), Fargo, North Dakota, United States|Temple University ( Site 1836), Philadelphia, Pennsylvania, United States|CHRISTUS Institute for Innovation & Advanced Clinical Care ( Site 1864), Corpus Christi, Texas, United States|Houston Methodist Hospital ( Site 1863), Houston, Texas, United States|Swedish Medical Center ( Site 1812), Edmonds, Washington, United States|Valley Medical Center ( Site 1815), Renton, Washington, United States|Swedish Medical Center ( Site 1861), Seattle, Washington, United States|Chronos Pesquisa Clínica ( Site 0105), Brasilia, Distrito Federal, Brazil|Santa Casa de Misericordia de Belo Horizonte ( Site 0100), Belo Horizonte, Minas Gerais, Brazil|Hospital de Clinicas da Universidade Federal do Parana ( Site 0104), Curitiba, Parana, Brazil|Hospital Tacchini ( Site 0107), Bento Goncalves, Rio Grande Do Sul, Brazil|FUNFARME Hospital de Base Centro Integrado de Pesquisa ( Site 0101), Sao Jose do Rio Preto, Sao Paulo, Brazil|University Health Network - Toronto General Hospital ( Site 0201), Toronto, Ontario, Canada|Hospital Clinico Fusat ( Site 0300), Rancagua, Libertador General Bernardo O Higgins, Chile|Clinica Universidad de los Andes ( Site 0301), Santiago, Region M. De Santiago, Chile|Hospital Sotero del Rio [Santiago, Chile] ( Site 0304), Santiago, Region M. De Santiago, Chile|Complejo Hospitalario San Jose ( Site 0306), Santiago, Region M. De Santiago, Chile|Servicio de Salud Sur Hospital Lucio Cordova ( Site 0305), Santiago, Region M. De Santiago, Chile|Hospital Pablo Tobon Uribe ( Site 0404), Medellin, Antioquia, Colombia|Clinica de la Costa Ltda. ( Site 0402), Barranquilla, Atlantico, Colombia|Oncomedica S.A. ( Site 0406), Monteria, Cordoba, Colombia|Hospital Universitario San Ignacio ( Site 0401), Bogota, Distrito Capital De Bogota, Colombia|Fundacion Cardiovascular de Colombia ( Site 0403), Bucaramanca, Santander, Colombia|Fundacion Valle del Lili ( Site 0400), Cali, Valle Del Cauca, Colombia|Groupe Hospitalier Pellegrin ( Site 0511), Bordeaux, Gironde, France|Pitie Salpetriere University Hospital-Infectious Disease - Tropical Diseases ( Site 0504), Paris, Ile-de-France, France|C.H.U. de Toulouse. Hopital de Purpan ( Site 0501), Toulouse, Midi-Pyrenees, France|Centre Hospitalier de Tourcoing ( Site 0502), Tourcoing, Nord, France|CHU Hopital Saint Antoine ( Site 0505), Paris, France|Hopital Bichat - Claude Bernard ( Site 0503), Paris, France|Rambam Medical Center ( Site 2102), Haifa, Israel|Hadassah Medical Center. Ein Kerem ( Site 2103), Jerusalem, Israel|Chaim Sheba Medical Center ( Site 2100), Ramat Gan, Israel|ASST Fatebenefratelli-Ospedale Sacco ( Site 0601), Milano, Italy|Chungnam National University Hospital ( Site 2202), Daejeon, Taejon-Kwangyokshi, Korea, Republic of|Inha University Hospital ( Site 2204), Incheon, Korea, Republic of|The Catholic University of Korea Eunpyeong St Mary s Hospital ( Site 2205), Seoul, Korea, Republic of|Instituto Nacional de Ciencias Medicas y Nutricion Salvador Zubiran ( Site 0802), Ciudad de mexico, Distrito Federal, Mexico|Hospital Regional de Alta Especialidad del Bajio ( Site 0807), Leon, Guanajuato, Mexico|Hospital Civil de Guadalajara Fray Antonio Alcalde ( Site 0800), Guadalajara, Jalisco, Mexico|Hospital Universitario Dr. Jose Eleuterio Gonzalez ( Site 0803), Monterrey, Nuevo Leon, Mexico|University of the Philippines-Philippine General Hospital ( Site 0900), Manila, National Capital Region, Philippines|Lung Center of the Philippines ( Site 0902), Quezon City, National Capital Region, Philippines|Wojewodzki Szpital Specjalistyczny im. dr. Wladyslawa Bieganskiego ( Site 1001), Lodz-Baluty, Lodzkie, Poland|Samodzielny Publiczny Szpital Kliniczny Nr 1 w Lublinie ( Site 1004), Lublin, Lubelskie, Poland|Centrum Medyczne Pratia, Mazowiecki Szpital Specjalistyczny, Oddział Obserwacyjno - Zakaźny ( Site 1, Ostroleka, Mazowieckie, Poland|Centrum Medyczne w Lancucie Sp.zo.o. ( Site 1000), Lancut, Podkarpackie, Poland|Krasnogorsk City Hospital Number 1 ( Site 1119), Krasnogorsk, Moskovskaya Oblast, Russian Federation|City Clinical Hospital #40 ( Site 1109), Moscow, Moskva, Russian Federation|FSBI Central Hospital with Policlinics ( Site 1105), Moscow, Moskva, Russian Federation|Moscow Clinical Hospital #52 ( Site 1103), Moscow, Moskva, Russian Federation|City Hospital #40 ( Site 1113), Saint Petersburg, Sankt-Peterburg, Russian Federation|City Pokrovskaya hospital ( Site 1116), Saint-Petersburg, Sankt-Peterburg, Russian Federation|City Clinical Hospital #1 ( Site 1112), Smolensk, Smolenskaya Oblast, Russian Federation|Republican Clinical Infectious Hospital n.a. A.F. Agafonov ( Site 1100), Kazan, Tatarstan, Respublika, Russian Federation|IATROS International ( Site 1202), Bloemfontein, Free State, South Africa|Wits Baragwanath Clinical Trial Site ( Site 1204), Soweto, Gauteng, South Africa|TREAD Research ( Site 1201), Cape Town, Western Cape, South Africa|Clinical Projects Research Centre ( Site 1205), Worcester, Western Cape, South Africa|Hospital Universitari Vall d Hebron ( Site 1305), Barcelona, Cataluna, Spain|Hospital Clinic ( Site 1304), Barcelona, Spain|Hospital Universitari Germans Trias i Pujol ( Site 1303), Barcelona, Spain|Hospital Universitario Gregorio Maranon ( Site 1302), Madrid, Spain|Hospital Universitario Ramon y Cajal ( Site 1301), Madrid, Spain|Hospital Universitario La Paz ( Site 1300), Madrid, Spain|Ivano-Frankivsk Regional Clinical Infectious Diseases Hospital ( Site 1605), Ivano-Frankivsk, Ivano-Frankivska Oblast, Ukraine|CNE Central city clinical hospital of Ivano-Frankivsk city council ( Site 1604), Ivano-Frankivsk, Ivano-Frankivska Oblast, Ukraine|MNE Ivano-Frankivsk Regional Phthisiology-Pulmonology Center ( Site 1603), Ivano-Frankivsk, Ivano-Frankivska Oblast, Ukraine|CNPE of Kharkiv RC Regional Clinical Infectious Diseases Hospital ( Site 1606), Kharkiv, Kharkivska Oblast, Ukraine|Сommunal non-com. Institution Oleksandrivska clinical hospital Kyiv ( Site 1600), Kyiv, Kyivska Oblast, Ukraine|Odesa City Clinical Infectious Hospital ( Site 1611), Odesa, Odeska Oblast, Ukraine|Communal Non-Commercial Enterprise Central City Hospital ( Site 1615), Rivne, Rivnenska Oblast, Ukraine|Volyn Regional Clinical Hospital ( Site 1613), Lutsk, Volynska Oblast, Ukraine|Royal Free London NHS Foundation Trust ( Site 1700), London, London, City Of, United Kingdom|King's College Hospital ( Site 1705), London, London, City Of, United Kingdom|North Manchester General Hospital ( Site 1701), Manchester, United Kingdom",https://ClinicalTrials.gov/show/NCT04575584
NCT04575597,Efficacy and Safety of Molnupiravir (MK-4482) in Non-Hospitalized Adult Participants With COVID-19 (MK-4482-002),Recruiting,All,Phase 2|Phase 3,1450,"Phoenix Medical Group ( Site 1822), Peoria, Arizona, United States|Ruane Clinical Research Group, Inc. ( Site 2406), Los Angeles, California, United States|Men's Health Foundation ( Site 1820), Los Angeles, California, United States|UC Davis Medical Center ( Site 1833), Sacramento, California, United States|Emerson Clinical Research Institute ( Site 1828), Washington, District of Columbia, United States|Midway Immunology and Research Center ( Site 1837), Fort Pierce, Florida, United States|Indago Research & Health Center, Inc ( Site 1809), Hialeah, Florida, United States|Advanced Research For Health Improvement LLC ( Site 1816), Immokalee, Florida, United States|Advanced Research For Health Improvement LLC ( Site 1813), Naples, Florida, United States|Bliss Healthcare Services ( Site 1847), Orlando, Florida, United States|Javara Inc. ( Site 1869), Albany, Georgia, United States|IACT Health ( Site 1818), Columbus, Georgia, United States|Javara Inc. ( Site 1868), Fayetteville, Georgia, United States|Loretto Hospital ( Site 1886), Chicago, Illinois, United States|University of Nebraska Medical Center ( Site 2414), Omaha, Nebraska, United States|University of New Mexico, Health Sciences Center ( Site 1819), Albuquerque, New Mexico, United States|Saint Hope Foundation, Inc. ( Site 1830), Bellaire, Texas, United States|The Crofoot Research Center, Inc. ( Site 1812), Houston, Texas, United States|Javara Inc. ( Site 1866), Sugar Land, Texas, United States|Swedish Medical Center First Hill ( Site 1807), Seattle, Washington, United States|Multicare Health System ( Site 1811), Spokane, Washington, United States|Multicare Health System ( Site 1814), University Place, Washington, United States|Chronos Pesquisa Clínica ( Site 0155), Brasilia, Distrito Federal, Brazil|Santa Casa de Misericordia de Belo Horizonte ( Site 0150), Belo Horizonte, Minas Gerais, Brazil|Hospital de Clinicas da Universidade Federal do Parana ( Site 0154), Curitiba, Parana, Brazil|Hospital Tacchini ( Site 0157), Bento Goncalves, Rio Grande Do Sul, Brazil|Instituto de Infectologia Emilio Ribas ( Site 0153), Sao Paulo, Brazil|University Health Network - Toronto General Hospital ( Site 0201), Toronto, Ontario, Canada|Clinica Universidad de los Andes ( Site 0302), Santiago, Region M. De Santiago, Chile|Fundacion Arturo Lopez Perez ( Site 0305), Santiago, Region M. De Santiago, Chile|Espacio EME ( Site 0304), Santiago, Region M. De Santiago, Chile|Clinica Bicentenario Spa ( Site 0306), Santiago, Region M. De Santiago, Chile|Hospital Pablo Tobon Uribe ( Site 0405), Medellin, Antioquia, Colombia|Clinica de la Costa Ltda. ( Site 0403), Barranquilla, Atlantico, Colombia|Oncomedica S.A. ( Site 0407), Monteria, Cordoba, Colombia|Caja de Compensación Familiar CAFAM. Sede Centro de Atención en Salud CAFAM Floresta ( Site 0406), Bogota, Cundinamarca, Colombia|Fundacion Cardiovascular de Colombia ( Site 0402), Bucaramanca, Santander, Colombia|Fundacion Valle del Lili ( Site 0401), Cali, Valle Del Cauca, Colombia|Groupe Hospitalier Pellegrin ( Site 0511), Bordeaux, Gironde, France|C.H.U. de Toulouse Hopital Purpan ( Site 0501), Toulouse, Midi-Pyrenees, France|Centre Hospitalier de Tourcoing ( Site 0502), Tourcoing, Nord, France|CHU Hopital Saint Antoine ( Site 0505), Paris, France|Pitie Salpetriere University Hospital-Infectious Disease - Tropical Diseases ( Site 0504), Paris, France|Hopital Bichat Claude Bernard ( Site 0503), Paris, France|Universitaetsklinikum Essen ( Site 2305), Essen, Baden-Wurttemberg, Germany|Universitaetsklinikum Frankfurt ( Site 2302), Frankfurt a main, Hessen, Germany|ZIBP-Zentrum fur Infektiologie Berlin Prenzlauer Berg GmbH ( Site 2301), Berlin, Germany|Hadassah Medical Center. Ein Kerem ( Site 2100), Jerusalem, Israel|ASST Fatebenefratelli-Ospedale Sacco ( Site 0601), Milano, Italy|Instituto Nacional de Ciencias Medicas y Nutricion Salvador Zubiran ( Site 0802), Ciudad de mexico, Distrito Federal, Mexico|Hospital Regional de Alta Especialidad del Bajio ( Site 0807), Leon, Guanajuato, Mexico|Hospital Civil de Guadalajara Fray Antonio Alcalde ( Site 0800), Guadalajara, Jalisco, Mexico|Hospital Universitario Dr. Jose Eleuterio Gonzalez ( Site 0803), Monterrey, Nuevo Leon, Mexico|Lung Center of the Philippines ( Site 0902), Quezon City, National Capital Region, Philippines|Central Scientific Research Institute of Epidemiology ( Site 1104), Moscow, Moskva, Russian Federation|Central Clinical Hospital with Polyclinic ( Site 1105), Moscow, Moskva, Russian Federation|Medical Research Institute LLC ( Site 1116), Saint Petersburg, Sankt-Peterburg, Russian Federation|St.Petersburg Outpatient Clinic No. 109 ( Site 1119), Saint-Petersburg, Sankt-Peterburg, Russian Federation|Limited liability company ""Scientific research center Eco-safety"" ( Site 1117), Saint-Petersburg, Sankt-Peterburg, Russian Federation|Smolensk State Medical University ( Site 1110), Smolensk, Smolenskaya Oblast, Russian Federation|Strategic Medical System LLC ( Site 1114), Saint-Petersburg, Russian Federation|IATROS International ( Site 1212), Bloemfontein, Free State, South Africa|Mzansi Ethical Research Centre ( Site 1225), Mpumalanga, Gauteng, South Africa|Jongaie Research ( Site 1223), Pretoria-West, Gauteng, South Africa|Wits Baragwanath Clinical Trial Site ( Site 1214), Soweto, Gauteng, South Africa|Enhancing Care Foundation-DICRS ( Site 1216), Durban, Kwazulu-Natal, South Africa|Limpopo Clinical Research Initiative ( Site 1227), Thabazimbi, Limpopo, South Africa|TREAD Research ( Site 1211), Cape Town, Western Cape, South Africa|Desmond Tutu HIV Foundation Clinical Trial Unit ( Site 1219), Cape Town, Western Cape, South Africa|Be Part Yoluntu Centre ( Site 1218), Paarl, Western Cape, South Africa|Clinical Projects Research Centre ( Site 1215), Worcester, Western Cape, South Africa|Hospital General Universitario Gregorio Maranon ( Site 1302), Madrid, Madrid, Comunidad De, Spain|CAP Sardenya - Barcelona ( Site 1307), Barcelona, Spain|Hospital Clinic ( Site 1304), Barcelona, Spain|Hospital Universitari Germans Trias i Pujol ( Site 1303), Barcelona, Spain|Hospital Universitario Ramon y Cajal ( Site 1301), Madrid, Spain|Hospital Universitario La Paz ( Site 1300), Madrid, Spain|Ivano-Frankivsk Regional Clinical Infectious Diseases Hospital ( Site 1605), Ivano-Frankivsk, Ivano-Frankivska Oblast, Ukraine|CNE Central city clinical hospital of Ivano-Frankivsk city council ( Site 1604), Ivano-Frankivsk, Ivano-Frankivska Oblast, Ukraine|MNE Ivano-Frankivsk Regional Phthisiology-Pulmonology Center ( Site 1603), Ivano-Frankivsk, Ivano-Frankivska Oblast, Ukraine|Non profit municipal enterprise City hospital student of Kharkiv city council ( Site 1621), Kharkiv, Kharkivska Oblast, Ukraine|LLC ""Adonis plus"" ( Site 1619), Kyiv, Kyivska Oblast, Ukraine|Kyiv railway clinical hospital 2 of Branch Health center ( Site 1602), Kyiv, Kyivska Oblast, Ukraine|ARTEM. State Holding Company ( Site 1618), Kyiv, Kyivska Oblast, Ukraine|Layton Medical Centre ( Site 1705), Blackpool, Lancashire (England), United Kingdom|Royal Free London NHS Foundation Trust ( Site 1700), London, London, City Of, United Kingdom|King's College Hospital ( Site 1707), London, London, City Of, United Kingdom|Newcastle upon Tyne Hospitals NHS Foundation Trust ( Site 1704), Newcastle upon Tyne, United Kingdom",https://ClinicalTrials.gov/show/NCT04575597
NCT04575610,IRAK4 Inhibition in Treatment of COVID-19 With ARDS (I-RAMIC),Recruiting,All,Phase 2,68,"Yale New Haven Hospital, New Haven, Connecticut, United States",https://ClinicalTrials.gov/show/NCT04575610
NCT04579393,Fostamatinib for Hospitalized Adults With COVID-19,"Active, not recruiting",All,Phase 2,80,"National Institutes of Health Clinical Center, Bethesda, Maryland, United States|INOVA Health Systems, Falls Church, Virginia, United States",https://ClinicalTrials.gov/show/NCT04579393
NCT04579458,Assessment of COVID-19 in Tearfilm,Withdrawn,All,,0,"Vanderbilt University Medical Center, Nashville, Tennessee, United States",https://ClinicalTrials.gov/show/NCT04579458
NCT04579549,Repeat Testing for SARS-CoV-2,Enrolling by invitation,All,Not Applicable,10000,"University of Wisconsin, Madison, Wisconsin, United States",https://ClinicalTrials.gov/show/NCT04579549
NCT04579588,Understanding Immunity to the Flu Vaccine in COVID-19 Patients,Enrolling by invitation,All,,100,"Stanford University, Hospital, and Clinics, Stanford, California, United States",https://ClinicalTrials.gov/show/NCT04579588
NCT04581161,Proportional Open Ventilation (POV) Device and Its Efficacy in Managing Acute Respiratory Failure in COVID-19 Patients,Recruiting,All,Not Applicable,10,"Park Nicolette, Bloomington, Minnesota, United States",https://ClinicalTrials.gov/show/NCT04581161
NCT04581200,Lift Mobile Mindfulness for COVID-19 Distress Symptoms,Recruiting,All,Not Applicable,300,"University of Colorado - Denver, Aurora, Colorado, United States|University of Michigan, Ann Arbor, Michigan, United States|Duke University Medical Center, Durham, North Carolina, United States|Oregon Health & Sciences University, Portland, Oregon, United States",https://ClinicalTrials.gov/show/NCT04581200
NCT04581811,Prolonged Prone Positioning for COVID-19-induced Acute Respiratory Distress Syndrome (ARDS),Recruiting,All,Not Applicable,52,"University of Alabama at Birmingham, Birmingham, Alabama, United States",https://ClinicalTrials.gov/show/NCT04581811
NCT04581863,COVID-19 Watch + COVID-19 Pulse,"Active, not recruiting",All,Not Applicable,850,"Perelman Center for Advanced Medicine, Philadelphia, Pennsylvania, United States",https://ClinicalTrials.gov/show/NCT04581863
NCT04582201,An Experiment to Evaluate the Safety of agenT-797 in COVID-19 Patients With Severe Difficulty Breathing.,Recruiting,All,Phase 1,55,"Weill Cornell Medicine New York Presbyterian, New York, New York, United States",https://ClinicalTrials.gov/show/NCT04582201
NCT04582214,Oscillation and Lung Expansion Therapy in Patients With COVID-19,Recruiting,All,Not Applicable,30,"Emory University, Atlanta, Georgia, United States|Northwestern University, Evanston, Illinois, United States",https://ClinicalTrials.gov/show/NCT04582214
NCT04582266,PK and Safety of Remdesivir for Treatment of COVID-19 in Pregnant and Non-Pregnant Women in the US,Recruiting,Female,,40,"USC/Los Angeles County Medical Center NICHD CRS (5048), Los Angeles, California, United States|David Geffen School of Medicine at UCLA (CRS 5112), Los Angeles, California, United States|University California, San Diego (CRS 4601), San Diego, California, United States|Childrens Hospital (U. Colorado, Denver) NICHD CRS (5052), Denver, Colorado, United States|University of Florida (5051), Jacksonville, Florida, United States|Univ of Miami Pediatric/Perinatal HIV/AIDS (4201), Miami, Florida, United States|Emory University School of Medicine (CRS 5030), Atlanta, Georgia, United States|Ann & Robert H Lurie Children's Hospital of Chicago (4001), Chicago, Illinois, United States|Rush University Cook County Hospital NICHD CRS (5083), Chicago, Illinois, United States|Johns Hopkins University NICHD CRS (5092), Baltimore, Maryland, United States|Boston Medical Center Ped. HIV Program NICHD CRS (5011), Boston, Massachusetts, United States|Bronx-Lebanon Hospital Center (CRS 5114), Bronx, New York, United States|Jacobi Med. Ctr. Bronx NICHD CRS (5013), Bronx, New York, United States|Stony Brook University Medical Center (CRS 5040), Stony Brook, New York, United States|St. Jude Childrens Research Hosp, Memphis (6501), Memphis, Tennessee, United States|Texas Children's Hospital, Houston, Texas, United States|University of Puerto Rico Pediatric HIV/AIDS CRS (6601), San Juan, Puerto Rico",https://ClinicalTrials.gov/show/NCT04582266
NCT04582331,Improving Real-time COVID-19 Monitoring Through Smartphone Voice Analysis,Recruiting,All,,300,"UC San Diego Medical Center, San Diego, California, United States|Brigham & Woman's Hospital, Boston, Massachusetts, United States|Montefiore Medical Center, New York, New York, United States|Deenanath Mangeshkar Hospital & Research Centre, Pune, India",https://ClinicalTrials.gov/show/NCT04582331
NCT04582903,Send-In Sample Collection for Comprehensive Analyses of Innate and Adaptive Immune Responses During Acute COVID-19 and Convalescence,Recruiting,All,,500,"Niaid/Lcim, Rockville, Maryland, United States",https://ClinicalTrials.gov/show/NCT04582903
NCT04583592,Camostat Efficacy vs. Placebo for Outpatient Treatment of COVID-19 (CAMELOT),Completed,All,Phase 2,295,"Palmtree Clinical Research, Inc. (Site 125), Palm Springs, California, United States|Synergy Healthcare, LLC (Site 124), Bradenton, Florida, United States|Clinical Research of Brandon, LLC (Site 123), Brandon, Florida, United States|Reliable Clinical Research, LLC (Site 100), Hialeah, Florida, United States|A+ Research (Site 112), Miami, Florida, United States|NextPhase Research Alliance at CANO HEALTH (Site 107), Miami, Florida, United States|Ezy Medical Research (Site 106), Miami, Florida, United States|Eminat LLC (Site 117), Plantation, Florida, United States|Invictus Clinical Research Group, LLC (Site 101), Pompano Beach, Florida, United States|Visionaries Clinical Research, LLC (Site 121), Atlanta, Georgia, United States|Family Care Research (Site 114), Boise, Idaho, United States|Cedar Crosse Research Center (Site 122), Chicago, Illinois, United States|Massachusetts General Hospital (Site 110), Boston, Massachusetts, United States|Oakland Medical Research Center (Site 108), Troy, Michigan, United States|Cary Research Group (Site 111), Cary, North Carolina, United States|Onsite Solutions (Site 118), Charlotte, North Carolina, United States|STAT Research (Site 109), Springboro, Ohio, United States|Toledo Institute of Clinical Research, Inc.(Site 105), Toledo, Ohio, United States|Advanced Medical Trials (Site 104), Georgetown, Texas, United States|Next Innovative Clinical Research (Site 115), Houston, Texas, United States|Rio Grand Valley Clinical Research Institute (Site 120), Pharr, Texas, United States",https://ClinicalTrials.gov/show/NCT04583592
