NCT Number,Title,Status,Gender,Phases,Enrollment,Locations,URL
NCT04432350,Assessment of Mortality Rates in COVID-19 Infected Populations Treated With Repurposed Medications,"Active, not recruiting",All,,50000,"Tabula Rasa HealthCare Precision Pharmacotherapy Research and Development Institute, Orlando, Florida, United States",https://ClinicalTrials.gov/show/NCT04432350
NCT04432766,A Phase 1/2 Study to Assess Safety and Efficacy of BAT2020 in Hospitalized COVID-19 Patients,Not yet recruiting,All,Phase 1|Phase 2,174,"Snake River Research, Idaho Falls, Idaho, United States",https://ClinicalTrials.gov/show/NCT04432766
NCT04432870,Patients' Preferences About Rescheduling Colonoscopies Delayed Due to COVID-19: Cross Sectional Study,Enrolling by invitation,All,,200,"Massachusetts General Hospital, Boston, Massachusetts, United States",https://ClinicalTrials.gov/show/NCT04432870
NCT04433078,RepurpoSing Old Drugs TO SuppRess a Modern Threat: COVID-19 STORM,Withdrawn,All,Phase 2,0,"Temple University Hospital, Philadelphia, Pennsylvania, United States",https://ClinicalTrials.gov/show/NCT04433078
NCT04433546,"Pemziviptadil (PB1046), a Long-acting, Sustained Release Human VIP Analogue, Intended to Provide Clinical Improvement to Hospitalized COVID-19 Patients at High Risk for Rapid Clinical Deterioration and Acute Respiratory Distress Syndrome (ARDS).",Terminated,All,Phase 2,54,"Baptist Health Research Institute, Jacksonville, Florida, United States|Sarasota Memorial Hospital, Sarasota, Florida, United States|The University of Kansas Medical Center, Kansas City, Kansas, United States|Adventist Healthcare White Oak Medical Center, Silver Spring, Maryland, United States",https://ClinicalTrials.gov/show/NCT04433546
NCT04433949,Best Supportive Care With or Without Low Dose Whole Lung Radiation Therapy for the Treatment of COVID-19,Recruiting,All,Phase 3,52,"Emory University Hospital/Winship Cancer Institute, Atlanta, Georgia, United States",https://ClinicalTrials.gov/show/NCT04433949
NCT04434131,Treatment With Investigational Convalescent Plasma and Measure Antibody Levels in Patients Hospitalized With COVID-19,Recruiting,All,Phase 2,30,"University of New Mexico Health Sciences Center, Albuquerque, New Mexico, United States",https://ClinicalTrials.gov/show/NCT04434131
NCT04435184,Crizanlizumab for Treating COVID-19 Vasculopathy,Completed,All,Phase 2,50,"Johns Hopkins Hospital, Baltimore, Maryland, United States",https://ClinicalTrials.gov/show/NCT04435184
NCT04435457,Cardiovascular Implications of COVID-19,Recruiting,All,,70,"University of Texas Southwestern Medical Center, Dallas, Texas, United States",https://ClinicalTrials.gov/show/NCT04435457
NCT04435522,Maraviroc in Patients With Moderate and Severe COVID-19,Completed,All,Phase 1,9,"Rhode Island Hospital, Providence, Rhode Island, United States",https://ClinicalTrials.gov/show/NCT04435522
NCT04435808,Efficacy of Hydroxychloroquine Prophylaxis for Health Care Workers at High Risk for COVID-19,Terminated,All,Phase 1|Phase 2,1,"University of New Mexico Health Sciences Center, Albuquerque, New Mexico, United States",https://ClinicalTrials.gov/show/NCT04435808
NCT04436276,A Study of Ad26.COV2.S in Adults (COVID-19),"Active, not recruiting",All,Phase 1|Phase 2,1085,"Optimal Research, San Diego, California, United States|Optimal Research, Melbourne, Florida, United States|Optimal Research, Peoria, Illinois, United States|Optimal Research, Rockville, Maryland, United States|Center for Virology and Vaccine Research, Beth Israel Deaconess Medical Center, Boston, Massachusetts, United States|AMR New Orleans, Formerly New Orleans Center for Clinical Research - New Orleans, an AMR company, Knoxville, Tennessee, United States|Optimal Research, Austin, Texas, United States|SGS Life Science Services, Antwerpen, Belgium|Center for Vaccinology (CEVAC), Gent, Belgium|UZ Leuven, Leuven, Belgium|Clinical Pharmacology Unit, Merksem, Belgium|Universiteit Antwerpen, Wilrijk, Belgium",https://ClinicalTrials.gov/show/NCT04436276
NCT04437706,Network-Targeted Strategies for Efficient Community SARS-CoV-2 (COVID-19) Sampling,Enrolling by invitation,All,,200,"Duke University Medical Center, Durham, North Carolina, United States",https://ClinicalTrials.gov/show/NCT04437706
NCT04438057,Evaluating the Efficacy of Convalescent Plasma in Symptomatic Outpatients Infected With COVID-19,Recruiting,All,Phase 2,150,"Metro Infectious Disease Consultants, Burr Ridge, Illinois, United States",https://ClinicalTrials.gov/show/NCT04438057
NCT04438967,Brain Health in the Time of COVID-19,Recruiting,All,,10000,"Miro Health, San Francisco, California, United States",https://ClinicalTrials.gov/show/NCT04438967
NCT04439006,Ibrutinib for the Treatment of COVID-19 in Patients Requiring Hospitalization,Recruiting,All,Phase 2,72,"Ohio State University Comprehensive Cancer Center, Columbus, Ohio, United States",https://ClinicalTrials.gov/show/NCT04439006
NCT04439071,A Study to Evaluate Efficacy and Safety of PTC299 in Hospitalized Participants With Coronavirus (COVID-19),Recruiting,All,Phase 2|Phase 3,380,"University of California, Irvine, Orange, California, United States|Augusta University, Augusta, Georgia, United States|Johns Hopkins Hospital, Baltimore, Maryland, United States|University of Massachusetts Memorial Health Care, Worcester, Massachusetts, United States|Salisbury VA Medical Center, Salisbury, North Carolina, United States|University Hospitals Cleveland, Cleveland, Ohio, United States|Ralph H. Johnson VA Medical Center, Charleston, South Carolina, United States|Columbia VA Health Care System, Columbia, South Carolina, United States|Westmead Hospital, Westmead, New South Wales, Australia|Monash Medical Centre, Clayton, Victoria, Australia|Sunshine Hospital, St. Albans, Victoria, Australia|St. Pierre University Hospital, Brussels, Belgium|Clinique Saint Pierre, Ottignies, Belgium|Hospital Vera Cruz, Belo Horizonte, MG, Brazil|Faculdade de Medicina da UNESP Campus de Botucatu, Botucatu, SP, Brazil|Hospital Guilherme Alvaro, Santos, SP, Brazil|Hospital Santa Casa de Misecórdia de Sorocoba, Sorocaba, SP, Brazil|Instituto de Infectologia Emílio Ribas, São Paulo, SP, Brazil|Real e Benemérita Associação Portuguesa de Beneficência, São Paulo, SP, Brazil|Hospital Alemao Oswaldo Cruz, São Paulo, SP, Brazil|Escola Paulista de Medicina (UNIFESP), São Paulo, SP, Brazil|Hospital General Dr. Manuel Gea González, Ciudad de Mexico, Cdmx, Mexico|Centro Hospitalario MAC, Irapuato, Guanajuato, Mexico|Hospital Universitario Dr. José Eleuterio Gonzalez, Monterrey, Nuevo León, Mexico|Centro Hospitalar Universitário de Lisboa Norte (CHULN), E.P.E - Hospital de Santa Maria, Lisboa, Portugal|Centro Hospitalar de Entre o Douro e Vouga, EPE (CHEDV), Santa Maria da Feira, Portugal|Centro Hospitalar de Vila Nova de Gaia/Espinho, EPE (CHVNG/E), Vila Nova de Gaia, Portugal|Hospital Del Mar, Barcelona, Spain|Hospital Universitario de Bellvitge, Barcelona, Spain|Hospital Universitario Infanta Leonor, Madrid, Spain|Hospital Universitario Ramón y Cajal, Madrid, Spain|Hospital 12 de Octubre, Madrid, Spain|Hospital Universitario Infanta Sofía, San Sebastián de los Reyes, Spain",https://ClinicalTrials.gov/show/NCT04439071
NCT04439084,COVID-19 in Patients With Chronic Liver Diseases,Enrolling by invitation,All,,1000,"University of Arizona,, Phoenix, Arizona, United States|Mayo Clinic, Scottsdale, Arizona, United States|UCSF Fresno, Fresno, California, United States|University of Southern California, Los Angeles, California, United States|Stanford University, Stanford, California, United States|Georgetown University, Washington, District of Columbia, United States|VA Medical Center, Washington, District of Columbia, United States|University of Miami, Miami, Florida, United States|Rush University Medical Center, Chicago, Illinois, United States|The University of Kansas Medical Center, Kansas City, Kansas, United States|Oschner Medical Center, Baton Rouge, Louisiana, United States|Massachusetts General Hospital, Boston, Massachusetts, United States|Brigham and Women's Hospital, Boston, Massachusetts, United States|Beth Israel Deaconess Medical Center, Boston, Massachusetts, United States|University of Michigan, Ann Arbor, Michigan, United States|Hennepin County Medical Center (HCMC), Minneapolis, Minnesota, United States|University of Minnesota, Minneapolis, Minnesota, United States|Mount Sinai School of Medicine, New York, New York, United States|Weill Cornell Medicine, New York, New York, United States|Duke University, Durham, North Carolina, United States|University Hospitals Cleveland Medical Center, Cleveland, Ohio, United States|University of Pennsylvania, Philadelphia, Pennsylvania, United States|University of Pittsburgh Medical Center, Pittsburgh, Pennsylvania, United States",https://ClinicalTrials.gov/show/NCT04439084
NCT04439825,Impact of Botox Treatment Into the Upper One Third of the Face an Area on Mood and Self -Appearance Satisfaction,Completed,All,Phase 1,45,"DeNova Research, Chicago, Illinois, United States",https://ClinicalTrials.gov/show/NCT04439825
NCT04440007,Study of the Efficacy and Safety of STI-5656 (Abivertinib Maleate) in Subjects Hospitalized With COVID-19,"Active, not recruiting",All,Phase 2,80,"MedStar Washington Hospital Center, Washington, District of Columbia, United States|Teradan Clinical Trials, Brandon, Florida, United States|Alexandria Cardiology Clinic, Alexandria, Louisiana, United States|Clinical Trials of SWLA, Lake Charles, Louisiana, United States|Quality Clinical Research, Omaha, Nebraska, United States|Memorial Hermann Memorial City Hospital, Houston, Texas, United States",https://ClinicalTrials.gov/show/NCT04440007
NCT04440098,Isolated During COVID-19: Effects of COVID-19's Social Restrictions on Loneliness and Psychosocial Symptomatology,Completed,All,,1008,"University of Miami, Miami, Florida, United States",https://ClinicalTrials.gov/show/NCT04440098
NCT04441047,Universal Anti-Viral Vaccine for Healthy Elderly Adults,Not yet recruiting,All,Phase 1|Phase 2,40,"Florida Medical Clinic, LLC, Zephyrhills, Florida, United States",https://ClinicalTrials.gov/show/NCT04441047
NCT04441632,Effect of Positive Attitudes on Behavior and Wellness,Completed,All,Not Applicable,24,"Cedars-Sinai Medical Center, Los Angeles, California, United States",https://ClinicalTrials.gov/show/NCT04441632
NCT04441996,Therapeutic Plasma Exchange for COVID-19-associated Hyperviscosity,Completed,All,Phase 4,20,"Emory Saint Joseph's Hospital, Atlanta, Georgia, United States|Emory University Hospital Midtown, Atlanta, Georgia, United States|Emory University Hospital, Atlanta, Georgia, United States",https://ClinicalTrials.gov/show/NCT04441996
NCT04442178,InterLeukin-7 to Improve Clinical Outcomes in Lymphopenic pAtients With COVID-19 Infection ( ILIAD-7-US-I ),Recruiting,All,Phase 2,48,"University of Florida College of Medicine, Gainesville, Florida, United States|Missouri Baptist Medical Center, Saint Louis, Missouri, United States|Rutgers Health, New Brunswick, New Jersey, United States|Stony Brook Medicine, Stony Brook, New York, United States|Cleveland Clinic Lerner College of Medicine, Cleveland, Ohio, United States",https://ClinicalTrials.gov/show/NCT04442178
NCT04442191,Convalescent Plasma as a Possible Treatment for COVID-19,Recruiting,All,Phase 2,50,"University of Illinois at Chicago, Chicago, Illinois, United States",https://ClinicalTrials.gov/show/NCT04442191
NCT04442230,NasoVAX in Patients With Early Coronavirus Infectious Disease 2019 (COVID-19),Recruiting,All,Phase 2,96,"Miami Dade Medical Research Institute, Miami, Florida, United States|Infinite Clinical Trials, Morrow, Georgia, United States|Cedar Crosse Research Center, Chicago, Illinois, United States|MedPharmics, Metairie, Louisiana, United States|Columbia University, New York, New York, United States|Carolina Institute for Clinical Research, Fayetteville, North Carolina, United States|Centex Studies, Houston, Texas, United States|Centex Studies, McAllen, Texas, United States",https://ClinicalTrials.gov/show/NCT04442230
NCT04445207,Experimental Expanded Access Treatment With Convalescent Plasma for the Treatment of Patients With COVID-19,Available,All,,,"UMass Medical School, Worcester, Massachusetts, United States",https://ClinicalTrials.gov/show/NCT04445207
NCT04445220,A Study of Cell Therapy in COVID-19 Subjects With Acute Kidney Injury Who Are Receiving Renal Replacement Therapy,Recruiting,All,Phase 1|Phase 2,22,"University of New Mexico School of Medicine, Albuquerque, New Mexico, United States",https://ClinicalTrials.gov/show/NCT04445220
NCT04445233,COVID-19 Household Transmission Study,"Active, not recruiting",All,,315,"University of North Carolina Health Care, Chapel Hill, North Carolina, United States",https://ClinicalTrials.gov/show/NCT04445233
NCT04445285,Phase 2 Trial Using rhDNase to Reduce Mortality in COVID-19 Patients With Respiratory Failure,Recruiting,All,Phase 2,44,"University of South Alabama, Mobile, Alabama, United States",https://ClinicalTrials.gov/show/NCT04445285
NCT04445402,Pediatrics HOT COVID-19 Database in NY Tristate,Recruiting,All,,1500,"Connecticut Children's Hospital, Hartford, Connecticut, United States|Yale New Haven Children's Hospital, New Haven, Connecticut, United States|Hackensack Meridian Health, Hackensack, New Jersey, United States|Steven Halpern, Morristown, New Jersey, United States|Archana Sharma, New Brunswick, New Jersey, United States|Mount Sinai Beth Israel, Newark, New Jersey, United States|St. Joseph's Regional Medical Center, New Jersey, Paterson, New Jersey, United States|Montefiore Medical Center, Bronx, New York, United States|Maimondes Medical Center, Brooklyn, New York, United States|Mount Sinai, New York, New York, United States|NYU Langone Health, New York, New York, United States|Columbia University Irving Medical Center, New York, New York, United States|Stephen Roberts, New York, New York, United States|Weill Cornell Medicine, New York, New York, United States|Cohen Children's Northwell Health, Queens, New York, United States|Stony Brook University Hospital, Stony Brook, New York, United States|Westchester Medical Center, Valhalla, New York, United States",https://ClinicalTrials.gov/show/NCT04445402
NCT04445506,Short Term Corticosteroids in SARS-CoV2 Patients,Completed,All,,50,"The Miriam Hospital, Providence, Rhode Island, United States",https://ClinicalTrials.gov/show/NCT04445506
NCT04446377,A Study of LAM-002A for the Prevention of Progression of COVID-19,Recruiting,All,Phase 2,142,"Yale University, New Haven, Connecticut, United States",https://ClinicalTrials.gov/show/NCT04446377
NCT04447222,Impact of the COVID-19 Pandemic and HRQOL in Cancer Patients and Survivors,Recruiting,All,,1242,"M D Anderson Cancer Center, Houston, Texas, United States",https://ClinicalTrials.gov/show/NCT04447222
NCT04447404,"DUR-928 in Subjects With SARS-CoV-2 With Acute Lung, Liver or Kidney Injury",Terminated,All,Phase 2,2,"Site 03, Newark, New Jersey, United States",https://ClinicalTrials.gov/show/NCT04447404
NCT04447469,Study of Mavrilimumab (KPL-301) in Participants Hospitalized With Severe Corona Virus Disease 2019 (COVID-19) Pneumonia and Hyper-inflammation,Recruiting,All,Phase 2|Phase 3,588,"UCLA Medical Center, Los Angeles, California, United States|Sharp Health Care, San Diego, California, United States|Affinity Health, Oak Brook, Illinois, United States|Tulane Medical Center, New Orleans, Louisiana, United States|Allina Health System, Minneapolis, Minnesota, United States|Mercy Hospital, Springfield, Missouri, United States|University of Cincinnati, Cincinnati, Ohio, United States|Bryn Mawr, Bryn Mawr, Pennsylvania, United States|University of Texas Health Sciences, Houston, Texas, United States|Instituto Mário Penna, Belo Horizonte, Brazil|Hospital Adventista de Belem, Belém, Brazil|UPECLIN - Unidade de Pesquisa Clínica, Botucatu, Brazil|IPECC - Instituto de Pesquisa Clínica de Campinas, Campinas, Brazil|IEP HGF - Instituto de Estudos e Pesquisas Clinicas do Ceará, Fortaleza, Brazil|Hospital Bruno Born, Lajeado, Brazil|Centro de Pesquisas Clínicas, Natal, Brazil|Hospital das Clínicas da Faculdade de Medicina de Ribeirão Preto da Universidade de São Paulo, Ribeirão Preto, Brazil|Hospital Cardio Pulmonar, Salvador, Brazil|Fundação Faculdade Regional de Medicina de São José do Rio Preto, São José, Brazil|Hospital Alemão Oswaldo Cruz, São Paulo, Brazil|Clinica Providencia, Santiago, Chile|Clinica Las Condes, Santiago, Chile|Hospital Essalud Alberto Sabogal Sologuren, Bellavista, Peru|Essalud - Hospital de Emergencias Grau, Lima Cercado, Peru|Hospital Nacional Cayetano Heredia, San Martín De Porres, Peru|Clinica Providencia, San Miguel, Peru|IATROS International, Bloemfontein, South Africa|Tiervlei Trial Center, Cape Town, South Africa|TASK Eden, George, South Africa|Into Research - Little Company of Mary Medical Center, Pretoria, South Africa|Limpopo Clinical Research Initiative, Rustenburg, South Africa",https://ClinicalTrials.gov/show/NCT04447469
NCT04448145,Determinants of SARS-COV2 (COVID-19) Persistence After Convalescence,Recruiting,All,,325,"Columbia University Medical Center, New York, New York, United States",https://ClinicalTrials.gov/show/NCT04448145
NCT04448756,Study of M5049 in Participants With COVID-19 Pneumonia (ANEMONE),Recruiting,All,Phase 2,150,"University of Alabama-Birmingham Hospital, Birmingham, Alabama, United States|LAC-USC Medical Center, Los Angeles, California, United States|Sharp Chula Vista Medical Center, San Diego, California, United States|Henry Ford Medical Center, Detroit, Michigan, United States|Saint Louis University - Saint Louis University Hospital, Saint Louis, Missouri, United States|Holy Name Hospital - Dept of Multiple Sclerosis Comp Care Center, Teaneck, New Jersey, United States|Christus Spohn Hospital Corpus Christi-Memorial, Corpus Christi, Texas, United States|Santa Casa de Misericórdia de Belo Horizonte, Belo Horizonte, Brazil|Hospital Dia do Pulmão, Blumenau, Brazil|Hospital São José - Sociedade Literária e Caritativa Santo Agostinho, Criciúma, Brazil|Hospital de Clínicas de Porto Alegre, Porto Alegre, Brazil|HMCG - Hospital e Maternidade Dr. Christovão da Gama, Santo André, Brazil|Pesquisare, Santo André, Brazil|Hospital Leforte Morumbi, Sao Paulo, Brazil|Hospital Alemão Oswaldo Cruz, São Paulo, Brazil|Hospital Bandeirantes / Hospital Leforte Liberdade, São Paulo, Brazil|Instituto de Infectologia Emílio Ribas, São Paulo, Brazil|Lung Center of the Philippines - Medicine, Quezon, Philippines",https://ClinicalTrials.gov/show/NCT04448756
NCT04449042,The PAWS-COVID-19 (Pediatric AirWay complicationS COVID-19) Registry,Recruiting,All,,15000,"Boston Children's Hopsital, Boston, Massachusetts, United States",https://ClinicalTrials.gov/show/NCT04449042
