NCT Number,Title,Status,Gender,Phases,Enrollment,Locations,URL
NCT00571389,Isolation and Culture of Immune Cells and Circulating Tumor Cells From Peripheral Blood and Leukapheresis Products,Recruiting,All,,1000,"Carolina BioOncology Institute, Huntersville, North Carolina, United States",https://ClinicalTrials.gov/show/NCT00571389
NCT01306084,Viral Infections in Healthy and Immunocompromised Hosts,Recruiting,All,,1000,"National Institutes of Health Clinical Center, 9000 Rockville Pike, Bethesda, Maryland, United States",https://ClinicalTrials.gov/show/NCT01306084
NCT02735707,"Randomized, Embedded, Multifactorial Adaptive Platform Trial for Community- Acquired Pneumonia",Recruiting,All,Phase 4,7100,"University of Pittsburgh Medical Centre, Pittsburgh, Pennsylvania, United States|St Vincent's Hospital Sydney, Sydney, New South Wales, Australia|Royal Prince Alfred Hospital, Sydney, New South Wales, Australia|Royal North Shore Hospital, Sydney, New South Wales, Australia|Nepean Hospital, Sydney, New South Wales, Australia|Wollongong Hospital, Sydney, New South Wales, Australia|Royal Darwin Hospital,, Darwin, Northern Territory, Australia|Sunshine Coast University Hospital, Birtinya, Queensland, Australia|Princess Alexandra Hospital, Brisbane, Queensland, Australia|Logan Hospital, Brisbane, Queensland, Australia|Toowoomba Hospital, Toowoomba, Queensland, Australia|The Queen Elizabeth Hospital, Adelaide, South Australia, Australia|Bendigo Hospital, Bendigo, Victoria, Australia|University Hosptial Geelong, Geelong, Victoria, Australia|The Alfred Hospital, Melbourne, Victoria, Australia|Royal Melbourne Hospital, Melbourne, Victoria, Australia|St Vincent's Hospital Melbourne, Melbourne, Victoria, Australia|Royal Perth Hospital, Perth, Western Australia, Australia|Sir Charles Gairdner Hospital, Perth, Western Australia, Australia|St John of God Hospital Midland, Perth, Western Australia, Australia|Fiona Stanley Hospital, Perth, Western Australia, Australia|St John of God Hospital Murdoch, Perth, Western Australia, Australia|AZ Sint-Jan, Brugge, Belgium|CHU de Charleroi - Hôpital Civil Marie Curie, Charleroi, Belgium|Universitair Ziekenhuis Antwerp, Edegem, Belgium|Universitair Ziekenhuis Gent, Gent, Belgium|St. Joseph's Healthcare Hamilton, Hamilton, Canada|Centre Hospitalier de l'Université de Sherbrooke, Sherbrooke, Canada|St. Michael's Hospital Unity Health Toronto, Toronto, Canada|General County Hospital Požega, Požega, Croatia|University Hospital Centre Zagreb, Zagreb, Croatia|University Hospital for Infectious Diseases, Zagreb, Croatia|Charité - Universitätsmedizin Berlin - Infektiologie und Pneumologie, Berlin, Germany|Charité - Universitätsmedizin Berlin - Nephrologie, Berlin, Germany|Vivantes Klinikum Neukölln, Berlin, Germany|Universitätsklinikum Köln, Cologne, Germany|Universitätsklinikum Frankfurt, Frankfurt, Germany|University Medical Center Hamburg-Eppendorf (UKE), Hamburg, Germany|Medizinische Hochschule Hannover, Hannover, Germany|Universitätsklinikum Jena, Jena, Germany|Universitätsklinikum Leipzig, Leipzig, Germany|Universitäts Klinikum Tübingen, Tübingen, Germany|Universitätsklinikum Würzburg, Würzburg, Germany|Jósa András County Hospital, Nyíregyháza, Hungary|Csolnoky Ferenc Kórház - Veszprem County Hospital, Veszprém, Hungary|Almási Balogh Pál Kórház, Ózd, Hungary|Beaumont Hospital, Dublin, Ireland|St. Vincent's University Hospital, Dublin, Ireland|University Hospital Galway, Galway, Ireland|Meander Medisch Centrum, Amersfoort, Netherlands|Jeroen Bosch Ziekenhuis, Den Bosch, Netherlands|Martini Hospital Groningen, Groningen, Netherlands|University Medical Center Groningen, Groningen, Netherlands|Leiden University Medical Center, Leiden, Netherlands|Canisius Wilhelmina Ziekenhuis, Nijmegen, Netherlands|Radboud University Medical Center, Nijmegen, Netherlands|University Medical Center Utrecht, Utrecht, Netherlands|North Shore Hospital, Auckland, New Zealand|CVICU, Auckland City Hospital, Auckland, New Zealand|DCCM, Auckland City Hospital, Auckland, New Zealand|Middlemore Hospital, Auckland, New Zealand|Christchurch Hospital, Christchurch, New Zealand|Waikato Hospital, Hamilton, New Zealand|Rotorua Hospital, Rotorua, New Zealand|Tauranga Hospital, Tauranga, New Zealand|Wellington Regional Hospital, Wellington, New Zealand|Whangarei Hospital, Whangarei, New Zealand|Centro Hospitalar do Medio Tejo, Abrantes, Portugal|Hospital Lusíadas Lisbon, Lisboa, Portugal|Clinical Hospital of Infectious and Tropical Diseases ""Dr. Victor Babes"", Bucharest, Romania|Institut Hospital del Mar d'Investigacions Mèdiques, Barcelona, Spain|Hospital Universitario Reina Sofia, Córdoba, Spain|Basingstoke and North Hampshire Hospital, Basingstoke, United Kingdom|Southmead Hospital, Bristol, United Kingdom|University Hospital Coventry, Coventry, United Kingdom|Darlington Memorial Hospital, Darlington, United Kingdom|University Hospital of North Durham, Durham, United Kingdom|Leeds Teaching Hospitals NHS Trust, Leeds, United Kingdom|Maidstone Hospital - Maidstone and Tunbridge Wells NHS Trust, Maidstone, United Kingdom|The James Cook University Hospital, Middlesbrough, United Kingdom|Milton Keynes University Hospital, Milton Keynes, United Kingdom|Northampton General Hospital, Northampton, United Kingdom|Queen's Medical Centre - Nottingham University Hospitals NHS Trust, Nottingham, United Kingdom|Poole Hospital NHS Foundation Trust, Poole, United Kingdom|Queen Alexandra Hospital - Portsmouth Hospitals NHS Trust, Portsmouth, United Kingdom|Royal Berkshire Hospital, Reading, United Kingdom|University Hospital of North Tees, Stockton-on-Tees, United Kingdom|Royal Cornwall Hospital, Truro, United Kingdom|Tunbridge Wells Hospital - Maidstone and Tunbridge Wells NHS Trust, Tunbridge Wells, United Kingdom|York Hospital, York, United Kingdom",https://ClinicalTrials.gov/show/NCT02735707
NCT03183570,"Detection of Integrin avb6 in IPF, PSC, and COVID19 Using PET/CT",Recruiting,All,Early Phase 1,30,"Stanford University, Stanford, California, United States",https://ClinicalTrials.gov/show/NCT03183570
NCT03256773,High Resolution Micro OCT Imaging,Recruiting,All,,60,"University of Alabama at Birmingham, Birmingham, Alabama, United States",https://ClinicalTrials.gov/show/NCT03256773
NCT03305341,Proof-of-Concept Clinical Pharmacology Trial for COVID-19 Antigen Presentation Therapeutic Biologics,"Active, not recruiting",All,Early Phase 1,20,"Medicine Invention Design Incorporation (MIDI) - IORG0007849, North Bethesda, Maryland, United States",https://ClinicalTrials.gov/show/NCT03305341
NCT03348670,Discovery Stage (Proof-of-concept) COVID-19 Antigen Presentation Therapeutic Biologics (COVID-19--AP),"Active, not recruiting",All,Early Phase 1,20,"Medicine Invention Design, Inc. (MIDI) - c/o - MIDINC Clinical Investigator Working Site, North Bethesda, Maryland, United States",https://ClinicalTrials.gov/show/NCT03348670
NCT03376854,Pilot RCT of Therapeutic Hypothermia Plus Neuromuscular Blockade in COVID-19 Patients With ARDS,Recruiting,All,Phase 2,20,"University of Maryland Medical Center, Baltimore, Maryland, United States",https://ClinicalTrials.gov/show/NCT03376854
NCT03452774,SYNERGY-AI: Artificial Intelligence Based Precision Oncology Clinical Trial Matching and Registry,Recruiting,All,,1500,"Massive Bio, Inc, New York, New York, United States",https://ClinicalTrials.gov/show/NCT03452774
NCT03474965,Study of Dose Confirmation and Safety of Crizanlizumab in Pediatric Sickle Cell Disease Patients,Recruiting,All,Phase 2,100,"University of Alabama 1600 7th ave, Birmingham, Alabama, United States|Phoenix Childrens Hospital CVAL489A2302, Phoenix, Arizona, United States|UC Davis Medical Center, Sacramento, California, United States|Children s National Hospital, Washington, District of Columbia, United States|University of Florida College of Medicine, Gainesville, Florida, United States|Joe DiMaggio Childrens Hospital, Hollywood, Florida, United States|Childrens Healthcare of Atlanta, Atlanta, Georgia, United States|Ann and Robert H Lurie Childrens Hospital of Chicago CTBM100C2407, Chicago, Illinois, United States|University of Chicago Hospital, Chicago, Illinois, United States|Childrens Hospital Boston, Boston, Massachusetts, United States|Institute for Pediatric Cancer and Blood Disorders, Hackensack, New Jersey, United States|UMDNJ, New Brunswick, New Jersey, United States|Children's Hospital at Montefiore, Bronx, New York, United States|Duke University Medical Center Oncology, Durham, North Carolina, United States|East Carolina University SC, Greenville, North Carolina, United States|Childrens Hospital of Philadelphia, Philadelphia, Pennsylvania, United States|Medical University of South Carolina Medical Uni of South Carolina, Charleston, South Carolina, United States|St. Jude Children's Research Hosptial, Memphis, Tennessee, United States|Cook Childrens Medical Center Oncology, Fort Worth, Texas, United States|Novartis Investigative Site, Edegem, Antwerpen, Belgium|Novartis Investigative Site, Brussel, Belgium|Novartis Investigative Site, Laeken, Belgium|Novartis Investigative Site, Liege, Belgium|Novartis Investigative Site, Salvador, BA, Brazil|Novartis Investigative Site, Ribeirao Preto, SP, Brazil|Novartis Investigative Site, São Paulo, SP, Brazil|Novartis Investigative Site, Toronto, Ontario, Canada|Novartis Investigative Site, Montreal, Quebec, Canada|Novartis Investigative Site, Medellin, Antioquia, Colombia|Novartis Investigative Site, Cali, Valle Del Cauca, Colombia|Novartis Investigative Site, Monteria, Colombia|Novartis Investigative Site, Paris cedex 15, France|Novartis Investigative Site, Heidelberg, Baden Wuerttemberg, Germany|Novartis Investigative Site, Berlin, Germany|Novartis Investigative Site, Nagpur, Maharashtra, India|Novartis Investigative Site, New Delhi, India|Novartis Investigative Site, Vellore, India|Novartis Investigative Site, Modena, Italy|Novartis Investigative Site, Orbassano, Italy|Novartis Investigative Site, Padova, Italy|Novartis Investigative Site, Beirut, Lebanon|Novartis Investigative Site, Tripoli, Lebanon|Novartis Investigative Site, Muscat, Oman|Novartis Investigative Site, Esplugues de Llobregat, Barcelona, Spain|Novartis Investigative Site, Barcelona, Catalunya, Spain|Novartis Investigative Site, Valencia, Comunidad Valenciana, Spain|Novartis Investigative Site, Palma De Mallorca, Islas Baleares, Spain|Novartis Investigative Site, Madrid, Spain|Novartis Investigative Site, Aarau, Aargau, Switzerland|Novartis Investigative Site, Adana, Turkey|Novartis Investigative Site, Mersin, Turkey|Novartis Investigative Site, London, United Kingdom|Novartis Investigative Site, London, United Kingdom",https://ClinicalTrials.gov/show/NCT03474965
NCT03738774,Addressing Post-Intensive Care Syndrome Among Survivors of COVID (APICS-COVID),Recruiting,All,,200,"Johns Hopkins Hospital, Baltimore, Maryland, United States|Beth Israel Deaconess Medical Center, Boston, Massachusetts, United States|Vanderbilt University, Nashville, Tennessee, United States|Intermountain Medical Center, Murray, Utah, United States|George Wahlen Salt Lake City Veterans Administration Hospital, Salt Lake City, Utah, United States",https://ClinicalTrials.gov/show/NCT03738774
NCT03808922,Phase III DAS181 Lower Tract PIV Infection in Immunocompromised Subjects (Substudy: DAS181 for COVID-19): RCT Study,Recruiting,All,Phase 3,274,"City of Hope cancer Center, Duarte, California, United States|UCLA, Los Angeles, California, United States|University of California Davis Health System, Sacramento, California, United States|University of California San Diego Medical Center, San Diego, California, United States|Children's Hospital Colorado, Aurora, Colorado, United States|Ann & Robert H. Lurie Children's Hospital of Chicago, Chicago, Illinois, United States|University of Chicago, Chicago, Illinois, United States|Loyola University Medical Center, Maywood, Illinois, United States|University of Kansas Medical Center, Fairway, Kansas, United States|Louisiana State University, Shreveport, Louisiana, United States|University of Maryland, Baltimore, Maryland, United States|The Johns Hopkins Hospital, Baltimore, Maryland, United States|Brigham and Women's Hospital, Boston, Massachusetts, United States|Beth Israel Deaconess Medical Center, Boston, Massachusetts, United States|Universtiy of Michigan, Ann Arbor, Michigan, United States|Washington University, Saint Louis, Missouri, United States|University of Nebraska Medical Center, Omaha, Nebraska, United States|Memorial Sloan Kettering Cancer Center, New York, New York, United States|Weill Cornell Medical College, New York, New York, United States|Duke University, Durham, North Carolina, United States|Novant Health, Winston-Salem, North Carolina, United States|The Lindner Center- The Christ Hospital, Cincinnati, Ohio, United States|Cincinnati Children's Hospital Medical Center, Cincinnati, Ohio, United States|University of Cincinnati, Cincinnati, Ohio, United States|The Cleveland Clinic Foundation, Cleveland, Ohio, United States|St. Elizabeth Youngstown Hospital, Youngstown, Ohio, United States|Oregon Health & Science University, Portland, Oregon, United States|University of Pennsylvania, Philadelphia, Pennsylvania, United States|University of Pittsburgh Medical Center Health System, Pittsburgh, Pennsylvania, United States|Kent Hospital, Warwick, Rhode Island, United States|Vanderbilt University Medical Center, Nashville, Tennessee, United States|Cook Children's, Fort Worth, Texas, United States|Texas Health, Fort Worth, Texas, United States|Therapeutic Concepts, Houston, Texas, United States|MD Anderson, Houston, Texas, United States|VCU Health System, Richmond, Virginia, United States|Seattle Children's Hospital, Seattle, Washington, United States|Fred Hutchinson Cancer Research Center, Seattle, Washington, United States|Medical College of Wisconsin, Milwaukee, Wisconsin, United States|Froedtert Medical College Pulmonary Clinic, Milwaukee, Wisconsin, United States|Westmead Hospital, Sydney, New South Wales, Australia|The Wesley Hospital, Auchenflower, Queensland, Australia|Peter MacCallum Cancer Centre, Melbourne, Victoria, Australia|Royal Melbourne Hospital, Melbourne, Victoria, Australia|Shanghai Pulmonary Hospital, Yangpu, Shanghai, China|West China Hospital, Chengdu, Sichuan, China|Shulan (Hangzhou) Hospital co., LTD, Hangzhou, Zhejiang, China|The First Affiliated Hospital, Zhejiang University School of Medicine, Hangzhou, Zhejiang, China|Rigshospitalet, Copenhagen, Denmark|Hôpital Henri Mondor, Créteil, Ile-de-France, France|Prince of Wales Hospital, Sha Tin, New Territories, Hong Kong|Samsung Medical Center, Gangnam-gu, Seoul, Gyeonggi-do, Korea, Republic of|Seoul National University Hospital, Jongno-gu, Seoul, Gyeonggi-do, Korea, Republic of|The Catholic University of Korea, Seoul St. Mary's Hospital, Seocho-gu, Seoul, Gyeonggi-do, Korea, Republic of|Seoul National University Bundang Hospital, Seongnam-si, Gyeonggi-do, Korea, Republic of|Asan Medical Center, Songpa-gu, Seoul, Gyeonggi-do, Korea, Republic of|National Cheng Kung University Hospital, North District, Tainan, Taiwan|National Taiwan University Hospital, Zhongzheng, Taipei City, Taiwan",https://ClinicalTrials.gov/show/NCT03808922
NCT03852537,Steroid Dosing by bioMARker Guided Titration in Critically Ill Patients With Pneumonia,Completed,All,Phase 1,44,"Mayo Clinic in Rochester, Rochester, Minnesota, United States",https://ClinicalTrials.gov/show/NCT03852537
NCT03907891,Reducing Hopelessness Through Improved Physical Activity in Adults With Heart Disease: With COVID-19 Considerations,Recruiting,All,Not Applicable,225,"Spectrum Health, Grand Rapids, Michigan, United States",https://ClinicalTrials.gov/show/NCT03907891
NCT03944447,Outcomes Mandate National Integration With Cannabis as Medicine for Prevention and Treatment of COVID-19,Recruiting,All,Phase 2,200000,"OMNI Medical Services, Boca Raton, Florida, United States|OMNI Medical Services, Bradenton, Florida, United States|OMNI Medical Services, Fort Lauderdale, Florida, United States|OMNI Medical Services, Fort Myers, Florida, United States|OMNI Medical Services, Gainesville, Florida, United States|OMNI Medical Services, Merritt Island, Florida, United States|OMNI Medical Services, Miami, Florida, United States|OMNI Medical Services, Ocoee, Florida, United States|OMNI Medical Services, Pensacola, Florida, United States|OMNI Medical Services, Pompano Beach, Florida, United States|OMNI Medical Services, Tampa, Florida, United States|OMNI Medical Services, Wesley Chapel, Florida, United States|OMNI Medical Services, Beechwood, Ohio, United States|OMNI Medical Services, Bowling Green, Ohio, United States|OMNI Medical Services, Sandusky, Ohio, United States|OMNI Medical Services, Toledo, Ohio, United States|OMNI Medical Services, Toledo, Ohio, United States",https://ClinicalTrials.gov/show/NCT03944447
NCT04025580,Systems Analyses of the Immune Response to the Seasonal Influenza Vaccine,Recruiting,All,Phase 2,300,"National Institutes of Health Clinical Center, Bethesda, Maryland, United States",https://ClinicalTrials.gov/show/NCT04025580
NCT04148430,A Study of Anakinra to Prevent or Treat Severe Side Effects for Patients Receiving CAR-T Cell Therapy,Recruiting,All,Phase 2,90,"Memorial Sloan Kettering Cancer Center, New York, New York, United States",https://ClinicalTrials.gov/show/NCT04148430
NCT04160975,Persuasion in Medicine: Experimental Evidence on Sender and Signal Effects,Completed,Male,Not Applicable,2902,"Harvard University, Cambridge, Massachusetts, United States",https://ClinicalTrials.gov/show/NCT04160975
NCT04169542,"Impact of COVID-19 Pandemic on Out-of-Pocket Costs, Lost Wages, and Unemployment in Patients With Breast Cancer Undergoing Breast Surgery",Recruiting,Female,,600,"MD Anderson in The Woodlands, Conroe, Texas, United States|M D Anderson Cancer Center, Houston, Texas, United States|MD Anderson League City, League City, Texas, United States|MD Anderson in Sugar Land, Sugar Land, Texas, United States",https://ClinicalTrials.gov/show/NCT04169542
NCT04240886,Open-label Study of APX001 for Treatment of Patients With Invasive Mold Infections Caused by Aspergillus or Rare Molds,Recruiting,All,Phase 2,50,"Clinical Trial Site, Duarte, California, United States|Clinical Trial Site, Sacramento, California, United States|Clinical Trial Site, San Diego, California, United States|Clinical Trial Site, Boston, Massachusetts, United States|Clinical Trial Site, Durham, North Carolina, United States|Clinical Trial Site, Brussels, Belgium|Clinical Trial Site, Brussels, Belgium|Clinical Trial Site, Leuven, Belgium|Clinical Trial Site, Yvoir, Belgium|Clinical Trial Site, Koeln, Germany|Clinical Trial Site, Mainz, Germany|Clinical Trial Site, Haifa, Israel|Clinical Trial Site, Tel Aviv, Israel|Clinical Trial Site, Tel HaShomer, Israel",https://ClinicalTrials.gov/show/NCT04240886
NCT04247620,DiaBetter Together for Young Adults With Type 1 Diabetes,Enrolling by invitation,All,Not Applicable,186,"Baylor College of Medicine, Houston, Texas, United States",https://ClinicalTrials.gov/show/NCT04247620
NCT04278404,"Pharmacokinetics, Pharmacodynamics, and Safety Profile of Understudied Drugs Administered to Children Per Standard of Care (POPS)",Recruiting,All,,5000,"Phoenix Children's Hospital, Phoenix, Arizona, United States|Arkansas Children's Hospital Research Institute, Little Rock, Arkansas, United States|University of California, Los Angeles, California, United States|Colorado University Denver, Aurora, Colorado, United States|Alfred I. DuPont Hospital for Children, Wilmington, Delaware, United States|University of Florida Jacksonville Shands Medical Center, Jacksonville, Florida, United States|Kapiolani Womens and Childrens Medical Center, Honolulu, Hawaii, United States|Ann and Robert H. Lurie Childrens Hospital of Chicago, Chicago, Illinois, United States|Riley Hospital for Children at Indiana University, Indianapolis, Indiana, United States|University of Iowa Stead Family Children's Hospital, Iowa City, Iowa, United States|University of Kansas Medical Center, Kansas City, Kansas, United States|Wesley Medical Center, Wichita, Kansas, United States|University of Louisville Norton Childrens Hospital, Louisville, Kentucky, United States|Tulane University Health Science Center, New Orleans, Louisiana, United States|Ochsner Baptist Clinical Trials Unit, New Orleans, Louisiana, United States|Boston Children's Hospital, Boston, Massachusetts, United States|Massachusetts General Hospital, Lexington, Massachusetts, United States|University of Minnesota, Minneapolis, Minnesota, United States|University of Mississippi Medical Center, Jackson, Mississippi, United States|Mississippi Center for Advanced Medicine, Madison, Mississippi, United States|Children's Mercy Hospital, Kansas City, Missouri, United States|Childrens Mercy Hospital, Kansas City, Missouri, United States|University of Nebraska Medical Center, Omaha, Nebraska, United States|Dartmouth-Hitchcock Medical Center, Lebanon, New Hampshire, United States|University of New Mexico Health Science Center, Albuquerque, New Mexico, United States|Kravis Children's Hospital at Mt. Sinai, New York, New York, United States|University of North Carolina at Chapel Hill, Chapel Hill, North Carolina, United States|Duke University Health System, Durham, North Carolina, United States|East Carolina University, Greenville, North Carolina, United States|New Hanover Regional Medical Center, Wilmington, North Carolina, United States|Cincinnati Childrens Hospital Medical Center, Cincinnati, Ohio, United States|Board of Regents of the University of Oklahoma, Oklahoma City, Oklahoma, United States|Oregon Health and Science University, Portland, Oregon, United States|Pennsylvania State University--Hershey Children's Hospital, Hershey, Pennsylvania, United States|Rhode Island Hospital, Providence, Rhode Island, United States|Medical University of South Carolina Children's Hospital, Charleston, South Carolina, United States|University of South Carolina, Columbia, South Carolina, United States|Monroe Carell Jr. Children's Hospital at Vanderbilt, Nashville, Tennessee, United States|Dell Children's Medical Center of Central Texas, Austin, Texas, United States|University of Texas-Southwestern Medical Center, Dallas, Texas, United States|University of Texas--Memorial Hermann Texas Medical Center, Houston, Texas, United States|Seattle Children's Hospital, Seattle, Washington, United States|University of Wisconsin, Madison, Wisconsin, United States|University of Wisconsin, Madison, Wisconsin, United States|University Wisconsin, Madison, Wisconsin, United States|Medical College of Wisconsin, Milwaukee, Wisconsin, United States|Children's Hospital of Eastern Ontario, Ottawa, Ontario, Canada|The Hospital for Sick Children, Toronto, Ontario, Canada|CHU Sainte-Justine, Montréal, Quebec, Canada",https://ClinicalTrials.gov/show/NCT04278404
