NCT Number,Title,Status,Gender,Phases,Enrollment,Locations,URL
NCT04371393,MSCs in COVID-19 ARDS,"Active, not recruiting",All,Phase 3,223,"Dignity Health, Gilbert, Arizona, United States|University of Southern California, Los Angeles, California, United States|Stanford University, Stanford, California, United States|Emory University, Atlanta, Georgia, United States|Lutheran Hospital, Fort Wayne, Indiana, United States|Ochsner Clinic, New Orleans, Louisiana, United States|Maine Medical Center, Portland, Maine, United States|University of Maryland, Baltimore, Maryland, United States|Brigham and Women's Hospital, Boston, Massachusetts, United States|University of Michigan, Ann Arbor, Michigan, United States|Dartmouth-Hitchcock, Lebanon, New Hampshire, United States|New York University Langone Health, New York, New York, United States|Mount Sinai Health, New York, New York, United States|Northwell Health, New York, New York, United States|Duke University Medical Center, Durham, North Carolina, United States|WakeMed, Raleigh, North Carolina, United States|Cleveland Clinic Foundation, Cleveland, Ohio, United States|University of Pennsylvania Health System, Philadelphia, Pennsylvania, United States|Houston Methodist Hospital, Houston, Texas, United States|Baylor, Smith & White, Plano, Texas, United States|University of Virginia, Charlottesville, Virginia, United States",https://ClinicalTrials.gov/show/NCT04371393
NCT04371419,COVID-19 Health Messaging to Underserved Communities,Completed,All,Not Applicable,15475,"JPAL North America, Cambridge, Massachusetts, United States",https://ClinicalTrials.gov/show/NCT04371419
NCT04371432,Genetics of COVID-19 Susceptibility and Manifestations,Recruiting,All,,2500,"National Institutes of Health Clinical Center, Bethesda, Maryland, United States",https://ClinicalTrials.gov/show/NCT04371432
NCT04371640,Sirolimus in COVID-19 Phase 1,Withdrawn,All,Phase 1,0,"Thomas Jefferson University Hospital, Philadelphia, Pennsylvania, United States",https://ClinicalTrials.gov/show/NCT04371640
NCT04372004,Comparison of the Efficacy of Rapid Tests to Identify COVID-19 Infection (CATCh COVID-19),Recruiting,All,Phase 1,100,"Texas Cardiac Arrhythmia Institute, Austin, Texas, United States",https://ClinicalTrials.gov/show/NCT04372004
NCT04372017,Hydroxychloroquine as Post-Exposure Prophylaxis Against COVID-19 Infection,"Active, not recruiting",All,Phase 3,1,"Sanford Health, Sioux Falls, South Dakota, United States",https://ClinicalTrials.gov/show/NCT04372017
NCT04372186,A Study to Evaluate the Efficacy and Safety of Tocilizumab in Hospitalized Participants With COVID-19 Pneumonia,Recruiting,All,Phase 3,379,"Banner - University Medical Center Phoenix; In-Patient Pharmacy, Phoenix, Arizona, United States|Univ of AZ Coll of Med, Tucson, Arizona, United States|El Centro Regional Medical Center, El Centro, California, United States|Harper University Hospital, Fountain Valley, California, United States|eStudySite, La Mesa, California, United States|Highland Hospital Oakland, Oakland, California, United States|St. Joseph'S Hospital, Orange, California, United States|San Leandro Hospital; Inpatient Pharmacy, San Leandro, California, United States|Howard University, Washington, District of Columbia, United States|Larkin Community Hospital Palm Springs Campus (Hialeah), Hialeah, Florida, United States|Miami Veterans Administration Healthcare System - NAVREF, Miami, Florida, United States|University of Miami Pulmonary, Miami, Florida, United States|Larkin Community Hospital, South Miami, Florida, United States|St. Lukes Boise Medical Center, Boise, Idaho, United States|Great Lakes Clinical Trials, Chicago, Illinois, United States|Ochsner Clinic, New Orleans, Louisiana, United States|LSU-Shreveport, Shreveport, Louisiana, United States|Holy Cross Germantown Hospital, Germantown, Maryland, United States|Holy Cross Hospital, Silver Spring, Maryland, United States|Detroit Receiving Hospital, Detroit, Michigan, United States|Henry Ford Health System, Detroit, Michigan, United States|Sinai Grace Hospital, Detroit, Michigan, United States|Optum Health Care, Las Vegas, Nevada, United States|St. Joseph'S Regional Medical Center, Paterson, New Jersey, United States|San Juan Oncology Associates, Farmington, New Mexico, United States|St. Barnabas Hospital, Bronx, New York, United States|Kings County Hospital Center, Brooklyn, New York, United States|SUNY Downstate Medical Center., Brooklyn, New York, United States|Elmhurst Hospital Center, Elmhurst, New York, United States|Flushing Hospital, Flushing, New York, United States|Jamaica Hospital Medical Center, Jamaica, New York, United States|NYC Health and Hospitals Queens, Jamaica, New York, United States|Harlem Hospital, New York, New York, United States|Canton-Potsdam Hospital, Potsdam, New York, United States|Novant Health Presbyterian Medical Center (Presbyterian Hospital), Charlotte, North Carolina, United States|Cape Fear Valley Medical Center, Fayetteville, North Carolina, United States|Novant Health Rowan Medical Center, Salisbury, North Carolina, United States|Novant Health Foryth Medical Center, Winston-Salem, North Carolina, United States|Temple University Hospital, Philadelphia, Pennsylvania, United States|JPS Health Network, Fort Worth, Texas, United States|Valley Baptist Medical Center, Harlingen, Texas, United States|Michael E Debakey VA Medical Center, Houston, Texas, United States|McAllen Medical Center, McAllen, Texas, United States|Crossroads Clinical Research, LLC, Victoria, Texas, United States|Sentara Medical Group, Virginia Beach, Virginia, United States|Froedtert and The Medical College of Wisconsin, Milwaukee, Wisconsin, United States|Hospital Unversitario Walter Cantidio, Fortaleza, CE, Brazil|Hospital Agamenon Magalhães, Recife, PE, Brazil|Hospital E Maternidade Celso Pierro PUCCAMP, Campinas, SP, Brazil|Centro Multidisciplinar de Estudos Clínicos CEMEC FMABC, Sao Bernardo Do Campo, SP, Brazil|BR Trials - Pesquisa Clínica, Sao Paulo, SP, Brazil|Escola Paulista de Medicina Da Universidade Federal de São Paulo - EPMUNIFESP, Sao Paulo, SP, Brazil|Hospital Heliópolis, Sao Paulo, SP, Brazil|Aga Khan University Hospital, Nairobi, Kenya|Organismo Publico Descentralizado Hospital Juarez de Mexico, Ciudad De México, Mexico|Hospital General de Culiacan, Culiacan, Mexico|Instituto Nacional de Ciencias Medicas y Nutricion Salvador Zubiran, Mexico, Mexico|Hospital Militar Central, Jesus Maria, Peru|Hospital Nacional Sergio E. Bernales, Lima, Peru|Hospital Nacional Arzobispo Loayza; Oncology, Lima, Peru|Hospital Nacional Cayetano Heredia, Lima, Peru|Hospital Nacional Hipolito; Unanue, Lima, Peru|Hospital Maria Auxiliadora, Lima, Peru|Hospital Nacional Dos de Mayo, Lima, Peru|University of the Free State, Bloemfontein, South Africa|George Provincial Hospital, George, South Africa|Peermed Clinical Trial Centre, Kempton Park, South Africa|Mzansi Ethical Research Centre, Middelburg, South Africa|Milpark Hospital, Parktown West, South Africa|University of Stellenbosch; Respiratory Research, Parow, South Africa|Phoenix Pharma, Port Elizabeth, South Africa",https://ClinicalTrials.gov/show/NCT04372186
NCT04372368,Convalescent Plasma for the Treatment of Patients With COVID-19,No longer available,All,,,"Children's Hospital Colorado, Aurora, Colorado, United States|University of Colorado Hospital, Aurora, Colorado, United States|UCHealth Memorial Hospital North, Colorado Springs, Colorado, United States|Denver Health Medical Center, Denver, Colorado, United States|UCHealth Poudre Valley Hospital, Fort Collins, Colorado, United States|UCHealth Highlands Ranch Hospital, Highlands Ranch, Colorado, United States",https://ClinicalTrials.gov/show/NCT04372368
NCT04372472,SQuISH-COVID: A Pilot Study,"Active, not recruiting",All,,300,"Our Lady of the Lake Regional Medical Center, Baton Rouge, Louisiana, United States",https://ClinicalTrials.gov/show/NCT04372472
NCT04372589,Antithrombotic Therapy to Ameliorate Complications of COVID-19 (ATTACC),"Active, not recruiting",All,Phase 2|Phase 3,1203,"Emory University Hospital Midtown, Atlanta, Georgia, United States|University of Chicago, Chicago, Illinois, United States|Ochsner Clinic, Jefferson, Louisiana, United States|Maine Medical Center, Portland, Maine, United States|Henry Ford University, Dearborn, Michigan, United States|Beaumont Hospital, Royal Oak, Michigan, United States|Mayo Clinic, Rochester, Minnesota, United States|Saint Louis University School of Medicine/Saint Louis Veterans Affairs Medical Center, Saint Louis, Missouri, United States|Cooper University Health Care, Camden, New Jersey, United States|Hackensack University Medical Center, Hackensack, New Jersey, United States|Saint Barnabas Medical Center, Livingston, New Jersey, United States|Montefiore-Einstein Center for Heart and Vascular Care, New York, New York, United States|Vanderbilt University Medical Center, Nashville, Tennessee, United States|Santa Casa de Misericordia de Itabuna, Itabuna, BA, Brazil|Hospital Unimed do Cariri, Juazeiro do Norte, CE, Brazil|Instituto Goiano de Oncologia e Hematologia - INGOH, Goiania, Goias, Brazil|Centro de Pesquisas Clínicas Humap - UFMS, Campo Grande, Mato Grosso Do Sul, Brazil|Hospital Felício Rocho, Belo Horizonte, MG, Brazil|Clinica de Campo Grande S/A, Campo Grande, MS, Brazil|Unimed Campo Grande, Campo Grande, MS, Brazil|Hospital Agamenon Magalhaes, Recife, Pernanbuco, Brazil|Hospital das Clinicas da UFPR, Curitiba, PR, Brazil|Pontifícia Universidade Católica do Paraná, Curitiba, PR, Brazil|Parana Medical Research Center, Maringa, PR, Brazil|Hospital Sao Vicente de Paulo, Passo Fundo, Rio Grande Do Sul, Brazil|Hospital Universitario Pedro Ernesto, Rio de Janeiro, RJ, Brazil|Hospital de Clinicas de Porto Alegre, Porto Alegre, RS, Brazil|Instituto de Cardiologia do Rio Grande do Sul, Porto Alegre, RS, Brazil|Instituto de Medicina Vascular, Porto Alegre, RS, Brazil|AngioCor Blumenau, Blumenau, Santa Catarina, Brazil|Instituto de Cardiologia de Santa Catarina, Sao Jose, Santa Catarina, Brazil|Instituto de Pesquisa Clínica de Campinas, Campinas, Sao Paulo, Brazil|Praxis Pesquisa Medica, Santo Andre, Sao Paulo, Brazil|Santa Casa de Votuporanga, Votuporanga, Sao Paulo, Brazil|Casa de Saúde Santa Marcelina, Sao Paulo, SP, Brazil|Instituto de Molestias Cardio Vasculares de Tatui, Tatui, SP, Brazil|Hospital 9 de Julho, São Paulo, Brazil|Hospital das Clinicas da Faculdade de Medicina da Universidade de São Paulo, São Paulo, Brazil|Instituto de Infectologia Emilio Ribas, São Paulo, Brazil|Instituto do Coração do Estado de São Paulo, São Paulo, Brazil|Sociedade Beneficente Israelita Hospital Albert Einstein, São Paulo, Brazil|Victoria General Hospital, Victoria, British Columbia, Canada|Health Sciences Center Winnipeg, Winnipeg, Manitoba, Canada|Grace General Hospital, Winnipeg, Manitoba, Canada|St. Boniface General Hospital, Winnipeg, Manitoba, Canada|Hamilton Health Sciences, Hamilton, Ontario, Canada|St. Joseph's Healthcare Hamilton, Hamilton, Ontario, Canada|Hôpital Montfort, Ottawa, Ontario, Canada|The Ottawa Hospital, Ottawa, Ontario, Canada|University Health Network, Toronto, Ontario, Canada|McGill University Health Centre, Montréal, Quebec, Canada|Centre Hospitalier de l'université de Montréal (CHUM), Montréal, Quebec, Canada|Jewish General Hospital, Montréal, Quebec, Canada|CHU de Quebec-University Laval, Québec, Quebec, Canada|Institut universitaire de cardiologie et de pneumologie de Québec (CRIUCPQ), Québec, Quebec, Canada|Centre Hospitalier Universitaire de Sherbrooke, Sherbrooke, Quebec, Canada|Regina General Hospital, Regina, Saskatchewan, Canada|Hospital de Infectolog´ñia Centro Médico Nacional La Raza, Azcapotzalco, Mexico City, Mexico|Hospital General Regional 1 Carlos MacGregor Sánchez Navarro, Benito Juárez, Mexico City, Mexico|Hospital General regional 2 El Marqués, Querétaro, Mexico",https://ClinicalTrials.gov/show/NCT04372589
NCT04372602,Duvelisib to Combat COVID-19,Recruiting,All,Phase 2,28,"Missouri Baptist Medical Center, Saint Louis, Missouri, United States|Washington University School of Medicine, Saint Louis, Missouri, United States",https://ClinicalTrials.gov/show/NCT04372602
NCT04372628,Trial of Early Therapies During Non-hospitalized Outpatient Window for COVID-19,Recruiting,All,Phase 2,600,"University of Colorado School of Medicine, Aurora, Colorado, United States|Beth Israel Deaconess Medical Center, Boston, Massachusetts, United States|University of Mississippi Medical Center, Jackson, Mississippi, United States|Oregon Health & Science University, Portland, Oregon, United States|Vanderbilt University Medical Center, Nashville, Tennessee, United States|University of Wisconsin, Madison, Wisconsin, United States",https://ClinicalTrials.gov/show/NCT04372628
NCT04373044,"Baricitinib, Placebo and Antiviral Therapy for the Treatment of Patients With Moderate and Severe COVID-19",Recruiting,All,Phase 2,144,"Los Angeles County-USC Medical Center, Los Angeles, California, United States|USC / Norris Comprehensive Cancer Center, Los Angeles, California, United States",https://ClinicalTrials.gov/show/NCT04373044
NCT04373135,"Understanding Community Considerations, Opinions, Values, Impacts, and Decisions for COVID-19","Active, not recruiting",All,Not Applicable,2500,"University of California, Los Angeles, Los Angeles, California, United States",https://ClinicalTrials.gov/show/NCT04373135
NCT04373148,"Understanding Immunity to SARS-CoV-2, the Coronavirus Causing COVID-19",Recruiting,All,,1000,"Stanford Health Care - ValleyCare, Pleasanton, California, United States|Stanford University, Hospital, and Clinics, Stanford, California, United States",https://ClinicalTrials.gov/show/NCT04373148
NCT04373161,Home Pulse Oximeter Use in Patients With COVID-19,Completed,All,Not Applicable,209,"Swedish Hospital, Chicago, Illinois, United States",https://ClinicalTrials.gov/show/NCT04373161
NCT04373460,Convalescent Plasma to Limit SARS-CoV-2 Associated Complications,Recruiting,All,Phase 2,1344,"University of Alabama at Birmingham, Birmingham, Alabama, United States|Center for American Indian Health - Chinle Office, Chinle, Arizona, United States|Mayo Clinic, Phoenix, Phoenix, Arizona, United States|University of Arizona, Phoenix, Tucson, Arizona, United States|University of Arizona, Tuscon, Tucson, Arizona, United States|Center for American Indian Health - Whiteriver Office, Whiteriver, Arizona, United States|University of California, Los Angeles, Los Angeles, California, United States|University of California, Irvine Health, Orange, California, United States|University of California, Davis, Sacramento, California, United States|Western Connecticut Health Netowrk, Danbury Hospital, Danbury, Connecticut, United States|Western Connecticut Health Network, Norwalk Hospital, Norwalk, Connecticut, United States|University of Miami, Coral Gables, Florida, United States|University of Miami Clinical Translational Research Site, Miami, Florida, United States|NorthShore University HealthSystem, Evanston, Illinois, United States|Tulane University, New Orleans, Louisiana, United States|Anne Arundel Medical Center, Annapolis, Maryland, United States|The Johns Hopkins University, Baltimore, Maryland, United States|MedStar Washington Hospital Center, Hyattsville, Maryland, United States|University of Massachusetts Worcester, Worcester, Massachusetts, United States|Wayne State University, Detroit, Michigan, United States|University of New Mexico Health Sciences Center, Albuquerque, New Mexico, United States|Center for American Indian Health - Gallup Office, Gallup, New Mexico, United States|Center for American Indian Health - Shiprock Office, Shiprock, New Mexico, United States|Vassar Brothers Medical Center, Poughkeepsie, New York, United States|University of Rochester, Rochester, New York, United States|University of Cincinnati Medical Center, Cincinnati, Ohio, United States|Lifespan/BrownUniversity (Rhode Island Hospital), Providence, Rhode Island, United States|Baylor College of Medicine, Houston, Texas, United States|University of Texas Health Science Center at Houston, Houston, Texas, United States|The University of Utah, Salt Lake City, Utah, United States",https://ClinicalTrials.gov/show/NCT04373460
NCT04374019,Novel Agents for Treatment of High-risk COVID-19 Positive Patients,Recruiting,All,Phase 2,240,"University of Kentucky Markey Cancer Center, Lexington, Kentucky, United States",https://ClinicalTrials.gov/show/NCT04374019
NCT04374071,Early Short Course Corticosteroids in COVID-19,Completed,All,,250,"Henry Ford Hospital, Detroit, Michigan, United States",https://ClinicalTrials.gov/show/NCT04374071
NCT04374149,Therapeutic Plasma Exchange Alone or in Combination With Ruxolitinib in COVID-19 Associated CRS,Completed,All,Phase 2,20,"Prisma Health, Greenville, South Carolina, United States",https://ClinicalTrials.gov/show/NCT04374149
NCT04374279,Trial to Promote Recovery From COVID-19 With Endocrine Therapy,Withdrawn,All,Phase 2,0,"Johns Hopkins Hospital, Baltimore, Maryland, United States",https://ClinicalTrials.gov/show/NCT04374279
NCT04374370,SARSCoV2 (COVID-19) Convalescent Plasma (CP) Expanded Access Protocol (EAP),Available,All,,,"AdventHealth Orlando, Orlando, Florida, United States",https://ClinicalTrials.gov/show/NCT04374370
NCT04374461,A Study of N-acetylcysteine in Patients With COVID-19 Infection,Recruiting,All,Phase 2,84,"Memorial Sloan Kettering Cancer Center, New York, New York, United States",https://ClinicalTrials.gov/show/NCT04374461
NCT04374552,Asymptomatic COVID-19 Trial,Withdrawn,All,Phase 2,0,"Robert Wood Johnson University Hospital, New Brunswick, New Jersey, United States",https://ClinicalTrials.gov/show/NCT04374552
NCT04374565,Convalescent Plasma for Treatment of COVID-19 Patients With Pneumonia,"Active, not recruiting",All,Phase 2,29,"University of Virginia Medical Center, Charlottesville, Virginia, United States|University of Virginia, Charlottesville, Virginia, United States",https://ClinicalTrials.gov/show/NCT04374565
NCT04374656,Prevalence of SARS-CoV-2 in Conjunctival Swab Samples Among Patients With Conjunctivitis During the COVID-19 Pandemic,Recruiting,All,,50,"Wilmer Eye Institute, Baltimore, Maryland, United States",https://ClinicalTrials.gov/show/NCT04374656
NCT04374786,Effects of Mobile App in House Staff Health and Well-being During COVID-19 Pandemic,Enrolling by invitation,All,Not Applicable,328,"Banner University Medical Center Phoenix, Phoenix, Arizona, United States",https://ClinicalTrials.gov/show/NCT04374786
NCT04375397,Study of Oral Ibrutinib Capsules to Assess Respiratory Failure in Adult Participants With Severe Acute Respiratory Syndrome Coronavirus-2 (SARS-CoV-2) and Pulmonary Injury,"Active, not recruiting",All,Phase 2,45,"Stanford Univ School Medicine /ID# 221954, Stanford, California, United States|Medstar Washington Hospital Center /ID# 221886, Washington, District of Columbia, United States|GW Medical Faculty Associates /ID# 222023, Washington, District of Columbia, United States|Midway Immunology and Research /ID# 222004, Fort Pierce, Florida, United States|University of Miami /ID# 223227, Miami, Florida, United States|Triple O Research Institute /ID# 222944, West Palm Beach, Florida, United States|Brigham & Women's Hospital /ID# 221847, Boston, Massachusetts, United States|Beth Israel Deaconess Medical Center /ID# 222994, Boston, Massachusetts, United States|Intermountain Healthcare /ID# 221955, Salt Lake City, Utah, United States",https://ClinicalTrials.gov/show/NCT04375397
NCT04375761,COVID-19: Human Epidemiology and Response to SARS-CoV-2,Completed,All,,5599,"Children's Hospital Colorado: Inner City Asthma Consortium (ICAC) Site, Aurora, Colorado, United States|Children's Hospital Colorado: Outcome Measures in Eosinophilic Gastrointestinal Disorders Across the Ages (OMEGA) Site, Aurora, Colorado, United States|Children's National Medical Center: Inner City Asthma Consortium (ICAC) Site, Washington, District of Columbia, United States|Ann & Robert H. Lurie Children's Hospital of Chicago: Food Allergy Outcomes Related to White and African American Racial Differences (FORWARD) and Improving Technology-Assisted Recording of Asthma Control in Children (iTRACC) Site, Chicago, Illinois, United States|Massachusetts General Hospital:Childhood Microbiome (CHIME) and Wheezing Index (WIND) Site, Boston, Massachusetts, United States|Boston Children's Hospital: School Inner-City Asthma Study (SICAS-2), Environmental Assessment of Sleep in Youth (EASY), Severe Asthma Research Program (SARP) and Preventing Asthma in High Risk Kids (PARK) Site, Boston, Massachusetts, United States|Boston Medical Center: Inner City Asthma Consortium (ICAC) Site, Boston, Massachusetts, United States|Henry Ford Health System: Childhood Allergy Study (CAS) Site, Detroit, Michigan, United States|Henry Ford Health System: Inner City Asthma Consortium (ICAC) Site, Detroit, Michigan, United States|Henry Ford Health System: Microbes, Asthma, Allergy and Pets (MAAP) and Wayne County Health, Environment, Allergy, and Asthma Longitudinal Study (WHEALS) Site, Detroit, Michigan, United States|St. Louis Children's Hospital: Inner City Asthma Consortium (ICAC) Site, Saint Louis, Missouri, United States|Columbia University Medical Center: Inner City Asthma Consortium (ICAC) Site, New York, New York, United States|Cincinnati Children's Hospital Medical Center: Greater Cincinnati Pediatric Clinic Repository (GCPCR) and Mechanisms of Progression of Atopic Dermatitis to Asthma in Children (MPAACH) Site, Cincinnati, Ohio, United States|Cincinnati Children's Hospital Medical Center: Inner City Asthma Consortium (ICAC) Site, Cincinnati, Ohio, United States|Cincinnati Children's Hospital Medical Center: Outcome Measures in Eosinophilic Gastrointestinal Disorders Across the Ages (OMEGA) Site, Cincinnati, Ohio, United States|Cincinnati Children's Hospital Medical Center:Cincinnati Childhood Allergy & Air Pollution Study (CCAAPS) Site, Cincinnati, Ohio, United States|Vanderbilt University Medical Center: Infant Susceptibility to Pulmonary Infections and Asthma Following RSV Exposure Study (INSPIRE) Site, Nashville, Tennessee, United States|University of Texas Southwestern Medical Center: Inner City Asthma Consortium (ICAC) Site, Dallas, Texas, United States|University of Wisconsin Hospital and Clinics: Childhood Origins of Asthma (COAST) Site, Madison, Wisconsin, United States|University of Wisconsin Hospital and Clinics: Wisconsin Infant Study Cohort (WISC) Site, Madison, Wisconsin, United States",https://ClinicalTrials.gov/show/NCT04375761
NCT04376034,Convalescent Plasma Collection and Treatment in Pediatrics and Adults,Recruiting,All,Phase 3,240,"WVU Medicine, Morgantown, West Virginia, United States",https://ClinicalTrials.gov/show/NCT04376034
NCT04376515,Harnessing Online Peer Education Online Support Intervention for COVID-19 (HOPE COVID-19),"Active, not recruiting",All,Not Applicable,300,"UC Irvine, Irvine, California, United States",https://ClinicalTrials.gov/show/NCT04376515
NCT04376593,PET/CT Imaging in COVID-19 Patients,Enrolling by invitation,All,Early Phase 1,10,"University of California Davis, Sacramento, California, United States",https://ClinicalTrials.gov/show/NCT04376593
